"feature","n_users","n_missing","pct_missing","source","aggregation_level","justification","privacy_level","includes_personal_data"
"ccaa",26146,0,0,"data/external/province_context.csv","provincia","Control territorial agregado para interpretar diferencias regulatorias y geograficas.","provincial_aggregate_no_personal_data",FALSE
"coastal_flag",26146,0,0,"data/external/province_context.csv","provincia","Indicador fisico agregado para separar costa/interior sin localizar usuarios.","provincial_aggregate_no_personal_data",FALSE
"density_bucket",26146,0,0,"data/external/province_context.csv","provincia","Bucket demografico provincial, usado solo como contexto macro.","provincial_aggregate_no_personal_data",FALSE
"climate_zone",26146,0,0,"data/external/province_context.csv","provincia","Zona climatica provincial para explicar heterogeneidad meteorologica residual.","provincial_aggregate_no_personal_data",FALSE
"goiener_core_region",26146,0,0,"data/external/province_context.csv","provincia","Marca agregada del nucleo territorial historico de GoiEner.","provincial_aggregate_no_personal_data",FALSE
